389,Revenue Center Payment Amount,"To obtain the Medicare payment amount for the services reported on the revenue center record, it is more accurate to use a different variable called the revenue center Medicare provider payment amount.",Outpatient;HHA;Hospice,NUM,12,ExplanationOfBenefit,item[N].adjudication[N].amount.value,item[%n].adjudication.where(category.coding.where(system = 'https://bluebutton.cms.gov/resources/codesystem/adjudication' and code = 'https://bluebutton.cms.gov/resources/variables/rev_cntr_pmt_amt_amt')).amount.value,item[N].adjudication[N].category.coding[N].system = 'https://bluebutton.cms.gov/resources/codesystem/adjudication';item[N].adjudication[N].category.coding[N].code = 'https://bluebutton.cms.gov/resources/variables/rev_cntr_pmt_amt_amt',"[\n  {\n    ""category"": {\n      ""coding"": [\n        {\n          ""system"": ""http://terminology.hl7.org/CodeSystem/adjudication"",\n          ""code"": ""submitted"",\n          ""display"": ""Submitted Amount""\n        },\n        {\n          ""system"": ""https://bluebutton.cms.gov/resources/codesystem/adjudication"",\n          ""code"": ""https://bluebutton.cms.gov/resources/variables/rev_cntr_pmt_amt_amt"",\n          ""display"": ""Revenue Center (Medicare) Payment Amount""\n        }\n      ]\n    },\n    ""amount"": {\n      ""value"": 5000,\n      ""currency"": ""USD""\n    }\n  }\n]",(eob.item[N].adjudication[N].category.coding[N].system = 'http://terminology.hl7.org/CodeSystem/adjudication';eob.item[N].adjudication[N].category.coding[N].code = 'submitted';eob.item[N].adjudication[N].category.coding[N].display = 'Submitted Amount');eob.item[N].adjudication[N].category.coding[N].display = 'Revenue Center (Medicare) Payment Amount';eob.item[N].adjudication[N].amount.currency = 'USD',,,REV_CNTR_PMT_AMT_AMT,,CLAIM LINE,rev_cntr_pmt_amt_amt,paymentAmount,,X,,X,X,X
390,Revenue Center Payment Method Indicator Code,The code used to identify how the service is priced for payment.,Outpatient;HHA,CHAR,2,,,,,,,,,REV_CNTR_PMT_MTHD_IND_CD,,CLAIM LINE,rev_cntr_pmt_mthd_ind_cd,paymentMethodCode,,,,,,X
391,Revenue Center Provider Payment Amount,The amount Medicare paid for the services reported on the revenue center record.,Outpatient;Hospice,NUM,12,ExplanationOfBenefit,item[N].adjudication[N].amount.value,item[%n].adjudication.where(category.coding.where(system='https://bluebutton.cms.gov/resources/codesystem/adjudication' and code='https://bluebutton.cms.gov/resources/variables/rev_cntr_prvdr_pmt_amt')).amount.value,item[N].adjudication[N].category.coding[N].system = 'https://bluebutton.cms.gov/resources/codesystem/adjudication';item[N].adjudication[N].category.coding[N].code = 'https://bluebutton.cms.gov/resources/variables/rev_cntr_prvdr_pmt_amt',"[\n  {\n    ""category"": {\n      ""coding"": [\n        {\n          ""system"": ""http://hl7.org/fhir/us/carin-bb/CodeSystem/C4BBAdjudication"",\n          ""code"": ""paidtoprovider"",\n          ""display"": ""Paid to provider""\n        },\n        {\n          ""system"": ""https://bluebutton.cms.gov/resources/codesystem/adjudication"",\n          ""code"": ""https://bluebutton.cms.gov/resources/variables/rev_cntr_prvdr_pmt_amt"",\n          ""display"": ""Revenue Center (Medicare) Provider Payment Amount""\n        }\n      ]\n    },\n    ""amount"": {\n      ""value"": 200,\n      ""currency"": ""USD""\n    }\n  }\n]",(eob.item[N].adjudication[N].category.coding[N].system = 'http://hl7.org/fhir/us/carin-bb/CodeSystem/C4BBAdjudication';eob.item[N].adjudication[N].category.coding[N].code = 'paidtoprovider';eob.item[N].adjudication[N].category.coding[N].display = 'Paid to provider';eob.item[N].adjudication[N].category.coding[N].display = 'Revenue Center (Medicare) Provider Payment Amount';eob.item[N].adjudication[N].amount.currency = 'USD',,,REV_CNTR_PRVDR_PMT_AMT,,CLAIM LINE,rev_cntr_prvdr_pmt_amt,providerPaymentAmount,,X,X,X,X,X
392,Revenue Center Patient Responsibility Payment Amount,The amount paid by the beneficiary to the provider for the line-item service.,Outpatient,NUM,12,ExplanationOfBenefit,item[N].adjudication[N].amount.value,item[%n].adjudication.where(category.coding.where(system='https://bluebutton.cms.gov/resources/codesystem/adjudication' and code='https://bluebutton.cms.gov/resources/variables/rev_cntr_ptnt_rspnsblty_pmt')).amount.value,item[N].adjudication[N].category.coding[N].system = 'https://bluebutton.cms.gov/resources/codesystem/adjudication';item[N].adjudication[N].category.coding[N].code = 'https://bluebutton.cms.gov/resources/variables/rev_cntr_ptnt_rspnsblty_pmt',"[\n  {\n    ""category"": {\n      ""coding"": [\n        {\n          ""system"": ""http://hl7.org/fhir/us/carin-bb/CodeSystem/C4BBAdjudication"",\n          ""code"": ""paidbypatient"",\n          ""display"": ""Paid by patient""\n        },\n        {\n          ""system"": ""https://bluebutton.cms.gov/resources/codesystem/adjudication"",\n          ""code"": ""https://bluebutton.cms.gov/resources/variables/rev_cntr_ptnt_rspnsblty_pmt"",\n          ""display"": ""Revenue Center Patient Responsibility Payment Amount""\n        }\n      ]\n    },\n    ""amount"": {\n      ""value"": 500,\n      ""currency"": ""USD""\n    }\n  }\n]",(eob.item[N].adjudication[N].category.coding[N].system = 'http://terminology.hl7.org/CodeSystem/adjudication';eob.item[N].adjudication[N].category.coding[N].code = 'paidbypatient';eob.item[N].adjudication[N].category.coding[N].display = 'Paid by Patient');eob.item[N].adjudication[N].category.coding[N].display = 'Revenue Center Patient Responsibility Payment Amount';eob.item[N].adjudication[N].amount.currency = 'USD',,,REV_CNTR_PTNT_RSPNSBLTY_PMT,,CLAIM LINE,rev_cntr_ptnt_rspnsblty_pmt,patientResponsibilityAmount,,X,,X,X,X
393,Revenue Center Rate Amount,Charges relating to unit cost associated with the revenue center code.,Inpatient;Outpatient;HHA;Hospice;SNF,NUM,12,ExplanationOfBenefit,item[N].adjudication[N].amount.value,item[%n].adjudication.where(category.coding.where(system='https://bluebutton.cms.gov/resources/codesystem/adjudication' and code='https://bluebutton.cms.gov/resources/variables/rev_cntr_rate_amt')).amount.value,item[N].adjudication[N].category.coding[N].system = 'https://bluebutton.cms.gov/resources/codesystem/adjudication';item[N].adjudication[N].category.coding[N].code = 'https://bluebutton.cms.gov/resources/variables/rev_cntr_rate_amt',"[\n  {\n    ""category"": {\n      ""coding"": [\n        {\n          ""system"": ""http://terminology.hl7.org/CodeSystem/adjudication"",\n          ""code"": ""submitted"",\n          ""display"": ""Submitted Amount""\n        },\n        {\n          ""system"": ""https://bluebutton.cms.gov/resources/codesystem/adjudication"",\n          ""code"": ""https://bluebutton.cms.gov/resources/variables/rev_cntr_rate_amt"",\n          ""display"": ""Revenue Center Rate Amount""\n        }\n      ]\n    },\n    ""amount"": {\n      ""value"": 0,\n      ""currency"": ""USD""\n    }\n  }\n]",(eob.item[N].adjudication[N].category.coding[N].system = 'http://terminology.hl7.org/CodeSystem/adjudication';eob.item[N].adjudication[N].category.coding[N].code = 'submitted';eob.item[N].adjudication[N].category.coding[N].display = 'Submitted Amount');eob.item[N].adjudication[N].category.coding[N].display = 'Revenue Center Rate Amount';eob.item[N].adjudication[N].amount.currency = 'USD',,,REV_CNTR_RATE_AMT,,CLAIM LINE,rev_cntr_rate_amt,rateAmount,,X,,X,X,X
394,Revenue Center Reduced Coinsurance Amount,"For all services subject to Outpatient prospective payment system (PPS or OPPS), the amount of coinsurance applicable to the line for a particular service (as indicated by the HCPCS code) for which the provider has elected to reduce the coinsurance amount.",Outpatient,NUM,12,ExplanationOfBenefit,item[N].adjudication[N].amount.value,item[%n].adjudication.where(category.coding.where(system='https://bluebutton.cms.gov/resources/codesystem/adjudication' and code='https://bluebutton.cms.gov/resources/variables/rev_cntr_rdcd_coinsrnc_amt')).amount.value,item[N].adjudication[N].category.coding[N].system = 'https://bluebutton.cms.gov/resources/codesystem/adjudication';item[N].adjudication[N].category.coding[N].code = 'https://bluebutton.cms.gov/resources/variables/rev_cntr_rdcd_coinsrnc_amt',"[\n  {\n    ""category"": {\n      ""coding"": [\n        {\n          ""system"": ""http://hl7.org/fhir/us/carin-bb/CodeSystem/C4BBAdjudication"",\n          ""code"": ""coinsurance"",\n          ""display"": ""Co-insurance""\n        },\n        {\n          ""system"": ""https://bluebutton.cms.gov/resources/codesystem/adjudication"",\n          ""code"": ""https://bluebutton.cms.gov/resources/variables/rev_cntr_rdcd_coinsrnc_amt"",\n          ""display"": ""Revenue Center Reduced Coinsurance Amount""\n        }\n      ]\n    },\n    ""amount"": {\n      ""value"": 11,\n      ""currency"": ""USD""\n    }\n  }\n]",(eob.item[N].adjudication[N].category.coding[N].system = 'http://terminology.hl7.org/CodeSystem/adjudication';eob.item[N].adjudication[N].category.coding[N].code = 'coinsurance';eob.item[N].adjudication[N].category.coding[N].display = 'Co-insurance');eob.item[N].adjudication[N].category.coding[N].display = 'Revenue Center Reduced Coinsurance Amount';eob.item[N].adjudication[N].amount.currency = 'USD',,,REV_CNTR_RDCD_COINSRNC_AMT,,CLAIM LINE,rev_cntr_rdcd_coinsrnc_amt,reducedCoinsuranceAmount,,X,,X,X,X
395,Revenue Center Status Indicator Code,This variable indicates how the service listed on the revenue center record was priced for payment purposes.,Outpatient;HHA,CHAR,2,ExplanationOfBenefit,item[N].revenue.extension[N].valueCoding.code,item[%n].revenue.extension.where(url = 'https://bluebutton.cms.gov/resources/variables/rev_cntr_stus_ind_cd').valueCoding.code,item[N].revenue.extension[N].url = 'https://bluebutton.cms.gov/resources/variables/rev_cntr_stus_ind_cd';,"[\n  {\n    ""url"": ""https://bluebutton.cms.gov/resources/variables/rev_cntr_stus_ind_cd"",\n    ""valueCoding"": {\n      ""system"": ""https://bluebutton.cms.gov/resources/variables/rev_cntr_stus_ind_cd"",\n      ""code"": ""A"",\n      ""display"": ""Services not paid under OPPS; uses a different fee schedule (e.g., ambulance, PT, mammography)""\n    }\n  }\n]",eob.item[N].revenue.extension[N].valueCoding.display = {corresponding description from valueset specified in .system},,,REV_CNTR_STUS_IND_CD,,CLAIM LINE,rev_cntr_stus_ind_cd,statusCode,,X,,X,X,X
396,Revenue Center Total Charge Amount,The total charges (covered and non-covered) for all accommodations and services (related to the revenue code) for a billing period before reduction for the deductible and coinsurance amounts and before an adjustment for the cost of services provided.,Inpatient;Outpatient;HHA;Hospice;SNF,NUM,12,ExplanationOfBenefit,item[N].adjudication[N].amount.value,item[%n].adjudication.where(category.coding.where(system='https://bluebutton.cms.gov/resources/codesystem/adjudication' and code='https://bluebutton.cms.gov/resources/variables/rev_cntr_tot_chrg_amt')).amount.value,item[N].adjudication[N].category.coding[N].system = 'https://bluebutton.cms.gov/resources/codesystem/adjudication';item[N].adjudication[N].category.coding[N].code = 'https://bluebutton.cms.gov/resources/variables/rev_cntr_tot_chrg_amt',"[\n  {\n    ""category"": {\n      ""coding"": [\n        {\n          ""system"": ""http://terminology.hl7.org/CodeSystem/adjudication"",\n          ""code"": ""submitted"",\n          ""display"": ""Submitted Amount""\n        },\n        {\n          ""system"": ""https://bluebutton.cms.gov/resources/codesystem/adjudication"",\n          ""code"": ""https://bluebutton.cms.gov/resources/variables/rev_cntr_tot_chrg_amt"",\n          ""display"": ""Revenue Center Total Charge Amount""\n        }\n      ]\n    },\n    ""amount"": {\n      ""value"": 84888.88,\n      ""currency"": ""USD""\n    }\n  }\n]",(eob.item[N].adjudication[N].category.coding[N].system = 'http://terminology.hl7.org/CodeSystem/adjudication';eob.item[N].adjudication[N].category.coding[N].code = 'submitted';eob.item[N].adjudication[N].category.coding[N].display = 'Submitted Amount');eob.item[N].adjudication[N].category.coding[N].display = 'Revenue Center Total Charge Amount';eob.item[N].adjudication[N].amount.currency = 'USD',,,REV_CNTR_TOT_CHRG_AMT,,CLAIM LINE,rev_cntr_tot_chrg_amt,totalChargeAmount,,X,,X,X,X
397,Revenue Center Unit Count,A quantitative measure (unit) of the number of times the service or procedure being reported was performed according to the revenue center/HCPCS code definition as described on an institutional claim.,Inpatient;Outpatient;HHA;Hospice;SNF,NUM,8,ExplanationOfBenefit,item[N]extension[N].valueQuantity.value,item[%n].extension.where(url='https://bluebutton.cms.gov/resources/variables/rev_cntr_unit_cnt').valueQuantity.value,extension[N].url = 'https://bluebutton.cms.gov/resources/variables/rev_cntr_unit_cnt',,,,"Technically speaking, this field should be in the eob.item.quantity, but since there is another value that was mapped, at least in V2, to this location, we are using an extension to store this value.",REV_CNTR_UNIT_CNT,CCLF2.CLM_LINE_SRVC_UNIT_QTY,CLAIM LINE,rev_cntr_unit_cnt,unitCount,,X,,X,X,X
398,Referring Physician NPI,The national provider identifier (NPI) number assigned to uniquely identify the referring physician.,Carrier;DME,CHAR,12,ExplanationOfBenefit,referral.identifier[N].value,referral.identifier.where(type.coding.where(code='npi')).value,referral.identifier[N].type.coding.system = 'http://hl7.org/fhir/us/carin-bb/CodeSystem/C4BBIdentifierType';referral.identifier[N].type.coding.code = 'npi',"[\n  {\n    ""type"": {\n      ""coding"": [\n        {\n          ""system"": ""http://hl7.org/fhir/us/carin-bb/CodeSystem/C4BBIdentifierType"",\n          ""code"": ""npi"",\n          ""display"": ""National Provider Identifier""\n        }\n      ]\n    },\n    ""value"": ""8765676""\n  }\n]",eob.referral.identifier[N].type.coding.display = 'National Provider Identifier',If Referring Physician NPI is supplied then Referring Physician NPI will be used for the eob.referral.identifier.,"For information about list elements and discriminators, see 'Slicing' in the Glossary tab ",RFR_PHYSN_NPI,CCLF6.ORDRG_PRVDR_NPI_NUM,CLAIM,rfr_physn_npi,referringPhysicianNpi,,X,,X,X,X
399,Referring Physician UPIN,The unique physician identification number (UPIN) of the physician who referred the beneficiary or the physician who ordered the Part B services or durable medical equipment (DME).,Carrier;DME,CHAR,12,ExplanationOfBenefit,referral.identifier[N].value,referral.identifier.where(type.coding.where(code='upin')).value,referral.identifier[N].type.coding.system = 'http://hl7.org/fhir/us/carin-bb/CodeSystem/C4BBIdentifierType';referral.identifier[N].type.coding.code = 'upin',,eob.careTeam[N].provider.identifier[N].type.coding[N].display = 'Medicare/CMS (formerly HCFA)'s Universal Physician Identification numbers',If Referring Physician NPI is not supplied and Referring Physician UPIN is supplied then Referring Physician UPIN will be used for the eob.referral.identifier.,"For information about list elements and discriminators, see 'Slicing' in the Glossary tab ",RFR_PHYSN_UPIN,,CLAIM,rfr_physn_upin,referringPhysicianUpin,,X,,X,X,
400,Rendering Physician NPI,This variable is the National Provider Identifier (NPI) for the physician who rendered the services.,Inpatient;Outpatient;HHA;Hospice;SNF,CHAR,12,ExplanationOfBenefit,careTeam[N].provider.identifier[N].value AND item[N].careTeamSequence,careTeam.where(role.coding.where(code='performing')).provider.identifier.where(type.coding.where(code='npi')).value,careTeam[N].provider.identifier[N]type.coding[N].system = 'http://hl7.org/fhir/us/carin-bb/CodeSystem/C4BBIdentifierType';careTeam[N].provider.identifier[N]type.coding[N].code = 'npi';careTeam[N].role.coding[N].code = 'performing',"[\n  {\n    ""type"": {\n      ""coding"": [\n        {\n          ""system"": ""http://hl7.org/fhir/us/carin-bb/CodeSystem/C4BBIdentifierType"",\n          ""code"": ""npi"",\n          ""display"": ""National Provider Identifier""\n        }\n      ]\n    },\n    ""value"": ""345345345""\n  }\n]",(eob.careTeam[N].role.coding[N].display = 'Performing provider';eob.careTeam[N].role.coding[N].system = 'http://hl7.org/fhir/us/carin-bb/CodeSystem/C4BBClaimCareTeamRole');eob.careTeam[N].provider.identifier[N].type.coding[N].display = 'National Provider Identifier',,The eob.careTeam[N].sequence will be stored in the eob.item[N].careTeamSequence list for the line item.,RNDRNG_PHYSN_NPI,,CLAIM LINE,rndrng_physn_npi,revenueCenterRenderingPhysicianNPI,X,X,,X,X,X
401,Rendering Physician UPIN,This variable is the unique physician identification number (UPIN) for the physician who rendered the services on the revenue center record.,Inpatient;Outpatient;HHA;Hospice;SNF,CHAR,12,ExplanationOfBenefit,careTeam[N].provider.identifier[N].value AND item[N].careTeamSequence,careTeam.where(role.coding.where(code='performing')).provider.identifier.where(type.coding.where(code='upin')).value,careTeam[N]provider.identifier[N]type.coding[N].system = 'http://terminology.hl7.org/CodeSystem/v2-0203';careTeam[N]provider.identifier[N]type.coding[N].code = 'UPIN';careTeam[N].role.coding[N].code = 'performing',"[\n  {\n    ""type"": {\n      ""coding"": [\n        {\n          ""system"": ""http://hl7.org/fhir/us/carin-bb/CodeSystem/C4BBIdentifierType"",\n          ""code"": ""npi"",\n          ""display"": ""National Provider Identifier""\n        }\n      ]\n    },\n    ""value"": ""345345345""\n  }\n]",eob.careTeam[N].role.coding[N].display = 'Performing provider';eob.careTeam[N].role.coding[N].system = 'http://hl7.org/fhir/us/carin-bb/CodeSystem/C4BBClaimCareTeamRole';eob.careTeam[N].provider.identifier[N].type.coding[N].display = 'Medicare/CMS (formerly HCFA)'s Universal Physician Identification numbers',For the Claim Line item that contains this provider upin the eob.careTeam[N].sequence will be stored in the eob.item[N].careTeamSequence list.,The eob.careTeam[N].sequence will be stored in the eob.item[N].careTeamSequence list.,RNDRNG_PHYSN_UPIN,,CLAIM LINE,rndrng_physn_upin,revenueCenterRenderingPhysicianUPIN,X,X,,X,X,
402,Gap Discount Amount,"This variable indicates the amount of the discount provided by the drug’s manufacturer under the Medicare Coverage Gap Discount Program, as calculated by CMS based on data reported in the PDE.",PDE,NUM,10,ExplanationOfBenefit,item[N].adjudication[N].amount.value,item[%n].adjudication.where(category.coding.where(system='https://bluebutton.cms.gov/resources/codesystem/adjudication' and code='https://bluebutton.cms.gov/resources/variables/rptd_gap_dscnt_num')).amount.value,item[N].adjudication[N].category.coding[N].system = 'https://bluebutton.cms.gov/resources/codesystem/adjudication';item[N].adjudication[N].category.coding[N].code = 'https://bluebutton.cms.gov/resources/variables/rptd_gap_dscnt_num',"[\n  {\n    ""category"": {\n      ""coding"": [\n        {\n          ""system"": ""http://hl7.org/fhir/us/carin-bb/CodeSystem/C4BBAdjudication"",\n          ""code"": ""discount"",\n          ""display"": ""Discount""\n        },\n        {\n          ""system"": ""https://bluebutton.cms.gov/resources/codesystem/adjudication"",\n          ""code"": ""https://bluebutton.cms.gov/resources/variables/rptd_gap_dscnt_num"",\n          ""display"": ""Gap Discount Amount""\n        }\n      ]\n    },\n    ""amount"": {\n      ""value"": 317.22,\n      ""currency"": ""USD""\n    }\n  }\n]",eob.item[N].adjudication[N].category.coding[N].system = 'http://terminology.hl7.org/CodeSystem/adjudication';eob.item[N].adjudication[N].category.coding[N].code = 'discount';eob.item[N].adjudication[N].category.coding[N].display = 'Discount';eob.item[N].adjudication[N].category.coding[N].display = 'Gap Discount Amount';eob.item[N].adjudication[N].amount.currency = 'USD',,,RPTD_GAP_DSCNT_NUM,,CLAIM LINE,rptd_gap_dscnt_num,gapDiscountAmount,,X,,X,X,X
403,Reason For Visit Diagnosis Code 1,The diagnosis code used to identify the patient's reason for the Hospital Outpatient visit.,Outpatient,CHAR,7,ExplanationOfBenefit,diagnosis[N].diagnosisCodeableConcept.coding[N].code,diagnosis.where(type.coding.where(system='http://hl7.org/fhir/us/carin-bb/CodeSystem/C4BBClaimDiagnosisType' and code='patientreasonforvisit')).diagnosisCodeableConcept.coding.where(system='http://hl7.org/fhir/sid/icd-10-cm').code,diagnosis[N].type[N].coding[N].system = 'http://hl7.org/fhir/us/carin-bb/CodeSystem/C4BBClaimDiagnosisType';diagnosis[N].type[N].coding[N].code = 'patientreasonforvisit',"[\n  {\n    ""system"": ""http://hl7.org/fhir/sid/icd-10-cm"",\n    ""code"": ""A37"",\n    ""display"": ""WHOOPING COUGH""\n  }\n]",eob.diagnosis[N].diagnosisCodeableConcept.coding[N].system = 'http://hl7.org/fhir/sid/icd-9-cm';eob.diagnosis[N].diagnosisCodeableConcept.coding[N].system = 'http://hl7.org/fhir/sid/icd-10-cm';eob.diagnosis[N].type[N].coding[N].display = 'Patient Reason for Visit';eob.diagnosis[N].sequence = ?,,,RSN_VISIT_CD1,,CLAIM,rsn_visit_cd1,diagnosisAdmission1Code,X,X,,X,X,
404,Reason For Visit Diagnosis Code 2,The diagnosis code used to identify the patient's reason for the Hospital Outpatient visit.,Outpatient,CHAR,7,ExplanationOfBenefit,diagnosis[N].diagnosisCodeableConcept.coding[N].code,diagnosis.where(type.coding.where(system='http://hl7.org/fhir/us/carin-bb/CodeSystem/C4BBClaimDiagnosisType' and code='patientreasonforvisit')).diagnosisCodeableConcept.coding.where(system='http://hl7.org/fhir/sid/icd-10-cm').code,diagnosis[N].type[N].coding[N].system = 'http://hl7.org/fhir/us/carin-bb/CodeSystem/C4BBClaimDiagnosisType';diagnosis[N].type[N].coding[N].code = 'patientreasonforvisit',"[\n  {\n    ""system"": ""http://hl7.org/fhir/sid/icd-10-cm"",\n    ""code"": ""A37"",\n    ""display"": ""WHOOPING COUGH""\n  }\n]",eob.diagnosis[N].diagnosisCodeableConcept.coding[N].system = 'http://hl7.org/fhir/sid/icd-9-cm';eob.diagnosis[N].diagnosisCodeableConcept.coding[N].system = 'http://hl7.org/fhir/sid/icd-10-cm';eob.diagnosis[N].type[N].coding[N].display = 'Patient Reason for Visit';eob.diagnosis[N].sequence = ?,,,RSN_VISIT_CD2,,CLAIM,rsn_visit_cd2,diagnosisAdmission2Code,X,X,,X,X,
405,Reason For Visit Diagnosis Code 3,The diagnosis code used to identify the patient's reason for the Hospital Outpatient visit.,Outpatient,CHAR,7,ExplanationOfBenefit,diagnosis[N].diagnosisCodeableConcept.coding[N].code,diagnosis.where(type.coding.where(system='http://hl7.org/fhir/us/carin-bb/CodeSystem/C4BBClaimDiagnosisType' and code='patientreasonforvisit')).diagnosisCodeableConcept.coding.where(system='http://hl7.org/fhir/sid/icd-10-cm').code,diagnosis[N].type[N].coding[N].system = 'http://hl7.org/fhir/us/carin-bb/CodeSystem/C4BBClaimDiagnosisType';diagnosis[N].type[N].coding[N].code = 'patientreasonforvisit',"[\n  {\n    ""system"": ""http://hl7.org/fhir/sid/icd-10-cm"",\n    ""code"": ""A37"",\n    ""display"": ""WHOOPING COUGH""\n  }\n]",eob.diagnosis[N].diagnosisCodeableConcept.coding[N].system = 'http://hl7.org/fhir/sid/icd-9-cm';eob.diagnosis[N].diagnosisCodeableConcept.coding[N].system = 'http://hl7.org/fhir/sid/icd-10';eob.diagnosis[N].type[N].coding[N].display = 'Patient Reason for Visit';eob.diagnosis[N].sequence = ?,,,RSN_VISIT_CD3,,CLAIM,rsn_visit_cd3,diagnosisAdmission3Code,X,X,,X,X,
406,Reason For Visit Diagnosis Code 1 Version,The code used to indicate if the reason for visit diagnosis code is ICD-9 or ICD-10.,Outpatient,CHAR,1,ExplanationOfBenefit,diagnosis[N].diagnosisCodeableConcept.coding[N].system,diagnosis.where(type.coding.where(system='http://hl7.org/fhir/us/carin-bb/CodeSystem/C4BBClaimDiagnosisType' and code='patientreasonforvisit')).diagnosisCodeableConcept.coding.where(system='http://hl7.org/fhir/sid/icd-10-cm').system,diagnosis[N].type[N].coding[N].system = 'http://hl7.org/fhir/us/carin-bb/CodeSystem/C4BBClaimDiagnosisType';diagnosis[N].type[N].coding[N].code = 'patientreasonforvisit',"[\n  {\n    ""system"": ""http://hl7.org/fhir/sid/icd-10-cm"",\n    ""code"": ""A37"",\n    ""display"": ""WHOOPING COUGH""\n  }\n]",,IF = 9 then eob.diagnosis[N].diagnosisCodeableConcept.coding[N].system = 'http://hl7.org/fhir/sid/icd-9-cm' IF = 0  eob.diagnosis[N].diagnosisCodeableConcept.coding[N].system = 'http://hl7.org/fhir/sid/icd-10-cm',,RSN_VISIT_VRSN_CD1,,CLAIM,rsn_visit_vrsn_cd1,diagnosisAdmission1CodeVersion,X,X,,X,X,
407,Reason For Visit Diagnosis Code 2 Version,The code used to indicate if the reason for visit diagnosis code is ICD-9 or ICD-10.,Outpatient,CHAR,1,ExplanationOfBenefit,diagnosis[N].diagnosisCodeableConcept.coding[N].system,diagnosis.where(type.coding.where(system='http://hl7.org/fhir/us/carin-bb/CodeSystem/C4BBClaimDiagnosisType' and code='patientreasonforvisit')).diagnosisCodeableConcept.coding.where(system='http://hl7.org/fhir/sid/icd-10-cm').system,diagnosis[N].type[N].coding[N].system = 'http://hl7.org/fhir/us/carin-bb/CodeSystem/C4BBClaimDiagnosisType';diagnosis[N].type[N].coding[N].code = 'patientreasonforvisit',"[\n  {\n    ""system"": ""http://hl7.org/fhir/sid/icd-10-cm"",\n    ""code"": ""A37"",\n    ""display"": ""WHOOPING COUGH""\n  }\n]",,IF = 9 then eob.diagnosis[N].diagnosisCodeableConcept.coding[N].system = 'http://hl7.org/fhir/sid/icd-9-cm' IF = 0  eob.diagnosis[N].diagnosisCodeableConcept.coding[N].system = 'http://hl7.org/fhir/sid/icd-10-cm',,RSN_VISIT_VRSN_CD2,,CLAIM,rsn_visit_vrsn_cd2,diagnosisAdmission2CodeVersion,X,X,,X,X,
