Element ID,Name,Description,Applies To,Data Type,Data Size,R4 Resource,R4 Element,R4 FhirPath,R4 Discriminator,R4 Example,R4 Additional,R4 Derived,R4 Notes,CCW Mapping,CCLF Mapping,BFD Table Type,BFD Column Name,BFD Java Field Name,AB2D,BB2,BCDA,BFD,DPC,Synthetic Data
1,Adjustment Deletion Code,This field distinguishes original from adjusted or deleted PDE records so CMS can adjust claims and make accurate payment for revised PDE records.,PDE,CHAR,1,ExplanationOfBenefit,supportingInfo[N].code.coding[N].code,supportingInfo.where(code.coding.system='https://bluebutton.cms.gov/resources/variables/adjstmt_dltn_cd').code.coding.code,supportingInfo[N].code.coding[N].system = 'https://bluebutton.cms.gov/resources/variables/adjstmt_dltn_cd',"[\n  {\n    ""sequence"": 7,\n    ""category"": {\n      ""coding"": [\n        {\n          ""system"": ""http://terminology.hl7.org/CodeSystem/claiminformationcategory"",\n          ""code"": ""info"",\n          ""display"": ""Information""\n        },\n        {\n          ""system"": ""https://bluebutton.cms.gov/resources/codesystem/information"",\n          ""code"": ""https://bluebutton.cms.gov/resources/variables/adjstmt_dltn_cd"",\n          ""display"": ""Adjustment Deletion Code""\n        }\n      ]\n    },\n    ""code"": {\n      ""coding"": [\n        {\n          ""system"": ""https://bluebutton.cms.gov/resources/variables/adjstmt_dltn_cd"",\n          ""code"": ""A"",\n          ""display"": ""Adjustment""\n        }\n      ]\n    }\n  }\n]",eob.supportingInfo[N].category.coding[N].system = 'http://terminology.hl7.org/CodeSystem/claiminformationcategory';eob.supportingInfo[N].category.coding[N].code = 'info';eob.supportingInfo[N].category.coding[N].display = 'Information';eob.supportingInfo[N].category.coding[N].system = 'https://bluebutton.cms.gov/resources/codesystem/information';eob.supportingInfo[N].category.coding[N].code = 'https://bluebutton.cms.gov/resources/variables/adjstmt_dltn_cd';eob.supportingInfo[N].category.coding[N].display = 'Adjustment Deletion Code';eob.supportingInfo[N].code.coding[N].display = {corresponding description from valueset specified in .system};,,,ADJSTMT_DLTN_CD,,CLAIM,adjstmt_dltn_cd,adjustmentDeletionCode,,X,,X,X,
2,Admitting Diagnosis Code,A diagnosis code on the institutional claim indicating the beneficiary's initial diagnosis at admission.,Inpatient;SNF,CHAR,7,ExplanationOfBenefit,diagnosis[N].diagnosisCodeableConcept.coding[N].code,diagnosis.where(type.coding.code='admitting').diagnosisCodeableConcept.coding.where(system='http://hl7.org/fhir/sid/icd-10-cm').code,diagnosis[N].type[N].coding[N].system = 'http://terminology.hl7.org/CodeSystem/ex-diagnosistype';diagnosis[N].type[N].coding[N].code = 'admitting',"[\n  {\n    ""system"": ""http://hl7.org/fhir/sid/icd-10-cm"",\n    ""code"": ""A37"",\n    ""display"": ""WHOOPING COUGH""\n  }\n]",eob.diagnosis[N].sequence = # selected by the code depending upon order of diagnosis;eob.diagnosis[N].diagnosisCodeableConcept.coding[N].system = 'http://hl7.org/fhir/sid/icd-9-cm';eob.diagnosis[N].diagnosisCodeableConcept.coding[N].system = 'http://hl7.org/fhir/sid/icd-10-cm';eob.diagnosis[N].diagnosisCodeableConcept.coding[N].system = 'http://hl7.org/fhir/sid/icd-10';eob.diagnosis[N].type[N].coding[N].display = 'Admitting Diagnosis';eob.diagnosis[N].extension[N].url = 'https://bluebutton.cms.gov/resources/variables/clm_poa_ind_sw1';eob.diagnosis[N].extension[N].valueCoding.system = 'https://bluebutton.cms.gov/resources/variables/clm_poa_ind_sw1';eob.diagnosis[N].extension[N].valueCoding.code = 'Y';eob.diagnosis[N].extension[N].valueCoding.display = 'Diagnosis was present at the time of admission (POA)',,,ADMTG_DGNS_CD,CCLF1.ADMTG_DGNS_CD,CLAIM,admtg_dgns_cd,diagnosisAdmittingCode,X,X,,X,X,X
3,Admitting Diagnosis Code Version,"Effective with Version ‘J,’ the code used to indicate if the diagnosis code is ICD-9/ICD-10.",Inpatient;SNF,CHAR,1,ExplanationOfBenefit,diagnosis[N].diagnosisCodeableConcept.coding[N].system,diagnosis.where(type.coding.code='admitting').diagnosisCodeableConcept.coding.where(system='http://hl7.org/fhir/sid/icd-10-cm').system,diagnosis[N].type[N].coding[N].system = 'http://terminology.hl7.org/CodeSystem/ex-diagnosistype';diagnosis[N].type[N].coding[N].code = 'admitting',"[\n  {\n    ""system"": ""http://hl7.org/fhir/sid/icd-10-cm"",\n    ""code"": ""A37"",\n    ""display"": ""WHOOPING COUGH""\n  }\n]",,IF = 9 then eob.diagnosis[N].diagnosisCodeableConcept.coding[N].system = 'http://hl7.org/fhir/sid/icd-9-cm'.  IF = 0  eob.diagnosis[N].diagnosisCodeableConcept.coding[N].system = 'http://hl7.org/fhir/sid/icd-10-cm',,ADMTG_DGNS_VRSN_CD,,CLAIM,admtg_dgns_vrsn_cd,diagnosisAdmittingCodeVersion,X,X,,X,X,X
4,Attending Physician NPI,"On an institutional claim, the national provider identifier (NPI) is a unique number assigned to identify the physician who has overall responsibility for the beneficiary's care and treatment.",Inpatient;Outpatient;HHA;Hospice;SNF,CHAR,10,ExplanationOfBenefit,careTeam[N].provider.identifier[N].value,careTeam.where(role.coding.where(code = 'attending')).provider.identifier.where(type.coding.where(code='npi')).value,careTeam[N].provider.identifier[N].type.coding[N].system = 'http://hl7.org/fhir/us/carin-bb/CodeSystem/C4BBIdentifierType';careTeam[N].provider.identifier[N].type.coding[N].code = 'npi';careTeam[N].role.coding[N].code = 'attending',"[\n  {\n    ""type"": {\n      ""coding"": [\n        {\n          ""system"": ""http://hl7.org/fhir/us/carin-bb/CodeSystem/C4BBIdentifierType"",\n          ""code"": ""npi"",\n          ""display"": ""National Provider Identifier""\n        }\n      ]\n    },\n    ""value"": ""161999999""\n  }\n]",eob.careTeam[N].role.coding[N].display = 'Attending';eob.careTeam[N].role.coding[N].system = 'http://hl7.org/fhir/us/carin-bb/CodeSystem/C4BBClaimCareTeamRole');eob.careTeam[N].provider.identifier[N].type.coding[N].display = 'National Provider Identifier',,,AT_PHYSN_NPI,CCLF1.ATNDG_PRVDR_NPI_NUM,CLAIM,at_physn_npi,attendingPhysicianNpi,X,X,,X,X,X
5,Attending Physician UPIN,"On an institutional claim, the unique physician identification number (UPIN) of the physician who would normally be expected to certify and recertify the medical necessity of the services rendered and/or who has primary responsibility for the beneficiary's medical care and treatment (attending physician).",Inpatient;Outpatient;HHA;Hospice;SNF,CHAR,6,ExplanationOfBenefit,careTeam[N].provider.identifier[N].value,careTeam.where(role.coding.where(code = 'attending')).provider.identifier.where(type.coding.where(code='upin')).value,careTeam[N].provider.identifier[N].type.coding[N].system = 'http://terminology.hl7.org/CodeSystem/v2-0203';careTeam[N].provider.identifier[N].type.coding[N].code = 'UPIN';careTeam[N].role.coding[N].code = 'attending',"[\n  {\n    ""type"": {\n      ""coding"": [\n        {\n          ""system"": ""http://hl7.org/fhir/us/carin-bb/CodeSystem/C4BBIdentifierType"",\n          ""code"": ""npi"",\n          ""display"": ""National Provider Identifier""\n        }\n      ]\n    },\n    ""value"": ""161999999""\n  }\n]",eob.careTeam[N].role.coding[N].display = 'Attending';eob.careTeam[N].role.coding[N].system = 'http://hl7.org/fhir/us/carin-bb/CodeSystem/C4BBClaimCareTeamRole');eob.careTeam[N].provider.identifier[N].type.coding[N].display = 'Medicare/CMS (formerly HCFA)'s Universal Physician Identification numbers',,,AT_PHYSN_UPIN,,CLAIM,at_physn_upin,attendingPhysicianUpin,X,X,,X,X,
6,Hospice Period Count,The count of the number of hospice period trailers present for the beneficiary's record.,Hospice,NUM,1,ExplanationOfBenefit,extension[N].valueQuantity.value,extension.where(url='https://bluebutton.cms.gov/resources/variables/bene_hospc_prd_cnt').valueQuantity.value,extension[N].url = 'https://bluebutton.cms.gov/resources/variables/bene_hospc_prd_cnt',"[\n  {\n    ""url"": ""https://bluebutton.cms.gov/resources/variables/bene_hospc_prd_cnt"",\n    ""valueQuantity"": {\n      ""value"": 2\n    }\n  }\n]",,,,BENE_HOSPC_PRD_CNT,,CLAIM,bene_hospc_prd_cnt,hospicePeriodCount,,X,,X,X,
7,Beneficiary Id,"The unique CCW identifier for a beneficiary. The CCW assigns a unique beneficiary identification number to each individual who receives Medicare and/or Medicaid and uses that number to identify an individual’s records in all CCW data files. This number does not change during a beneficiary’s lifetime, and CCW uses each number only once. The BENE_ID is specific to the CCW and is not applicable to any other identification system or data source.",PDE;Carrier;Inpatient;Outpatient;HHA;DME;Hospice;SNF,CHAR,15,ExplanationOfBenefit,patient,"patient.reference.substring(8,50)",,"[\n  ""Patient/567834""\n]",,Patient/+beneficiaryId,This field provides a reference to the Patient endpoint FHIR Resource so that this beneficiaries patient data can be pulled down using the reference id (beneficiaryId). The value will look something like this: 'Patient/123456'.,BENE_ID,,CLAIM,bene_id,beneficiaryId,X,X,X,X,X,X
8,Lifetime Reserved Days Used Count,The number of lifetime reserve days that the beneficiary has elected to use during the period covered by the institutional claim.,Inpatient,NUM,3,ExplanationOfBenefit,benefitBalance[N].financial[N].usedUnsignedInt,benefitBalance[%n].financial.where(type.coding.code='https://bluebutton.cms.gov/resources/variables/bene_lrd_used_cnt').usedUnsignedInt,benefitBalance[N].financial[N].type.coding[N].system = 'https://bluebutton.cms.gov/resources/codesystem/benefit-balance';benefitBalance[N].financial[N].type.coding[N].code = 'https://bluebutton.cms.gov/resources/variables/bene_lrd_used_cnt',"[\n  {\n    ""type"": {\n      ""coding"": [\n        {\n          ""system"": ""https://bluebutton.cms.gov/resources/codesystem/benefit-balance"",\n          ""code"": ""https://bluebutton.cms.gov/resources/variables/bene_lrd_used_cnt"",\n          ""display"": ""Beneficiary Medicare Lifetime Reserve Days (LRD) Used Count""\n        }\n      ]\n    },\n    ""usedUnsignedInt"": 0\n  }\n]",eob.benefitBalance[N].financial[N].type.coding[N].code = 'Beneficiary Medicare Lifetime Reserve Days (LRD) Used Count',,,BENE_LRD_USED_CNT,,CLAIM,bene_lrd_used_cnt,lifetimeReservedDaysUsedCount,,X,,X,X,X
9,Total Coinsurance Days Count,The count of the total number of coinsurance days involved with the beneficiary's stay in a facility.,Inpatient;SNF,NUM,3,ExplanationOfBenefit,benefitBalance[N].financial[N].usedUnsignedInt,benefitBalance[%n].financial.where(type.coding.code='https://bluebutton.cms.gov/resources/variables/bene_tot_coinsrnc_days_cnt').usedUnsignedInt,benefitBalance[N].financial[N].type.coding[N].system = 'https://bluebutton.cms.gov/resources/codesystem/benefit-balance';benefitBalance[N].financial[N].type.coding[N].code = 'https://bluebutton.cms.gov/resources/variables/bene_tot_coinsrnc_days_cnt',"[\n  {\n    ""type"": {\n      ""coding"": [\n        {\n          ""system"": ""https://bluebutton.cms.gov/resources/codesystem/benefit-balance"",\n          ""code"": ""https://bluebutton.cms.gov/resources/variables/bene_tot_coinsrnc_days_cnt"",\n          ""display"": ""Beneficiary Total Coinsurance Days Count""\n        }\n      ]\n    },\n    ""usedUnsignedInt"": 0\n  }\n]",eob.benefitBalance[N].financial[N].type.coding[N].display = 'Beneficiary Total Coinsurance Days Count',,,BENE_TOT_COINSRNC_DAYS_CNT,,CLAIM,bene_tot_coinsrnc_days_cnt,coinsuranceDayCount,,X,,X,X,X
10,BETOS Code,The Berenson-Eggers type of service (BETOS) for the procedure code based on generally agreed upon clinically meaningful groupings of procedures and services.,Carrier;DME,CHAR,3,ExplanationOfBenefit,item[N].extension[N].valueCoding.code,item[%n].extension.where(url = 'https://bluebutton.cms.gov/resources/variables/betos_cd').valueCoding.code,item[N].extension[N].url = 'https://bluebutton.cms.gov/resources/variables/betos_cd',"[\n  {\n    ""url"": ""https://bluebutton.cms.gov/resources/variables/betos_cd"",\n    ""valueCoding"": {\n      ""system"": ""https://bluebutton.cms.gov/resources/variables/betos_cd"",\n      ""code"": ""T2D"",\n      ""display"": ""Other tests - other""\n    }\n  }\n]",eob.item[N].extension[N].valueCoding.display = {corresponding description from valueset specified in .system},,,BETOS_CD,CCLF5.HCPCS_BETOS_CD,CLAIM LINE,betos_cd,betosCode,,X,,X,X,X
11,Brand Generic Code,Plan reported value indicating whether the plan adjudicated the claim as a brand or generic drug.,PDE,CHAR,1,ExplanationOfBenefit,supportingInfo[N].code.coding[N].code,supportingInfo.where(code.coding.system='https://bluebutton.cms.gov/resources/variables/brnd_gnrc_cd').code.coding.code,supportingInfo[N].code.coding[N].system = 'https://bluebutton.cms.gov/resources/variables/brnd_gnrc_cd',"[\n  {\n    ""sequence"": 12,\n    ""category"": {\n      ""coding"": [\n        {\n          ""system"": ""http://hl7.org/fhir/us/carin-bb/CodeSystem/C4BBSupportingInfoType"",\n          ""code"": ""brandgenericcode"",\n          ""display"": ""Brand Generic Code""\n        }\n      ]\n    },\n    ""code"": {\n      ""coding"": [\n        {\n          ""system"": ""https://bluebutton.cms.gov/resources/variables/brnd_gnrc_cd"",\n          ""code"": ""G"",\n          ""display"": ""Generic Null/missing""\n        }\n      ]\n    }\n  }\n]",eob.supportingInfo[N].code.coding[N].display = {corresponding description from valueset specified in .system};eob.supportingInfo[N].category.coding[N].system = 'http://hl7.org/fhir/us/carin-bb/CodeSystem/C4BBSupportingInfoType';eob.supportingInfo[N].category.coding[N].code = 'brandgenericcode';eob.supportingInfo[N].category.coding[N].display = 'Brand Generic Code',,,BRND_GNRC_CD,,CLAIM,brnd_gnrc_cd,brandGenericCode,,X,,X,X,X
12,Part B Deductible Applied Amount,The amount of the cash deductible as submitted on the claim. This variable is the beneficiary’s liability under the annual Part B deductible for all line items on the claim; it is the sum of all line-level deductible amounts.,Carrier;DME,NUM,12,ExplanationOfBenefit,benefitBalance[N].financial[N].usedMoney.value,benefitBalance[%n].financial.where(type.coding.code='https://bluebutton.cms.gov/resources/variables/carr_clm_cash_ddctbl_apld_amt').usedMoney.value,benefitBalance[N].financial[N].type.coding[N].system = 'https://bluebutton.cms.gov/resources/codesystem/benefit-balance';benefitBalance[N].financial[N].type.coding[N].code = 'https://bluebutton.cms.gov/resources/variables/carr_clm_cash_ddctbl_apld_amt',"[\n  {\n    ""type"": {\n      ""coding"": [\n        {\n          ""system"": ""https://bluebutton.cms.gov/resources/codesystem/benefit-balance"",\n          ""code"": ""https://bluebutton.cms.gov/resources/variables/carr_clm_cash_ddctbl_apld_amt"",\n          ""display"": ""Carrier Claim Cash Deductible Applied Amount (sum of all line-level deductible amounts)""\n        }\n      ]\n    },\n    ""usedMoney"": {\n      ""value"": 777,\n      ""currency"": ""USD""\n    }\n  }\n]",eob.benefitBalance[N].financial[N].type.coding[N].display = 'Carrier Claim Cash Deductible Applied Amount (sum of all line-level deductible amounts)';eob.benefitBalance[N].financial[N].usedMoney.currency = 'USD',,,CARR_CLM_CASH_DDCTBL_APLD_AMT,,CLAIM,carr_clm_cash_ddctbl_apld_amt,beneficiaryPartBDeductAmount,,X,,X,X,X
13,Claim Entry Code,"Carrier-generated code describing whether the Part B claim is an original debit, full credit, or replacement debit.",Carrier;DME,CHAR,1,ExplanationOfBenefit,extension[N].valueCoding.code,extension.where(url='https://bluebutton.cms.gov/resources/variables/carr_clm_entry_cd').valueCoding.code,extension[N].url = 'https://bluebutton.cms.gov/resources/variables/carr_clm_entry_cd';,"[\n  {\n    ""url"": ""https://bluebutton.cms.gov/resources/variables/carr_clm_entry_cd"",\n    ""valueCoding"": {\n      ""system"": ""https://bluebutton.cms.gov/resources/variables/carr_clm_entry_cd"",\n      ""code"": ""1"",\n      ""display"": ""Original debit; void of original debit (If CLM_DISP_CD = 3, code 1 means voided original debit)""\n    }\n  }\n]",eob.extension[N].valueCoding.display = {corresponding description from valueset specified in .system},,,CARR_CLM_ENTRY_CD,,CLAIM,carr_clm_entry_cd,claimEntryCode,,X,,X,X,X
14,HCPCS Year Code,The Healthcare Common Procedure Coding System (HCPCS) uses this terminal digit to specify the year that the HCPCS code was from for the claim.,Carrier;DME,CHAR,1,ExplanationOfBenefit,item[N].modifier[N].coding[N].version,item[%n].modifier.where(coding.system = 'https://bluebutton.cms.gov/resources/codesystem/hcpcs').coding.version,item[N].modifier[N].coding[N].system = 'https://bluebutton.cms.gov/resources/codesystem/hcpcs',"[\n  ""5""\n]",,,"If the HCPCS Year, is supplied, will be utilized for all HCPCS Modifiers for the item[N].modifier[N].coding[N].version.",CARR_CLM_HCPCS_YR_CD,,CLAIM LINE,carr_clm_hcpcs_yr_cd,hcpcsYearCode,,X,,X,X,X
15,Claim Payment Denial Code,The code on a non-institutional claim indicating who receives payment or if the claim was denied.,Carrier;DME,CHAR,2,ExplanationOfBenefit,extension[N].valueCoding.code,extension.where(url = 'https://bluebutton.cms.gov/resources/variables/carr_clm_pmt_dnl_cd').valueCoding.code,extension[N].url = 'https://bluebutton.cms.gov/resources/variables/carr_clm_pmt_dnl_cd',"[\n  {\n    ""url"": ""https://bluebutton.cms.gov/resources/variables/carr_clm_pmt_dnl_cd"",\n    ""valueCoding"": {\n      ""system"": ""https://bluebutton.cms.gov/resources/variables/carr_clm_pmt_dnl_cd"",\n      ""code"": ""1"",\n      ""display"": ""Physician/supplier""\n    }\n  }\n]",eob.extension[N].valueCoding.display = {corresponding description from valueset specified in .system},,,CARR_CLM_PMT_DNL_CD,CCLF5.CLM_CARR_PMT_DNL_CD,CLAIM,carr_clm_pmt_dnl_cd,paymentDenialCode,,X,,X,X,X
16,Carrier Primary Payer Paid Amount,"The amount of a payment made on behalf of a Medicare beneficiary by a primary payer other than Medicare, that the provider is applying to covered Medicare charges on a non-institutional claim.",Carrier;DME,NUM,12,ExplanationOfBenefit,total.amount.value,total.where(category.coding.where(code='https://bluebutton.cms.gov/resources/variables/clm_tot_chrg_amt')).amount.value,total.category.coding[N].system = 'https://bluebutton.cms.gov/resources/codesystem/adjudication';total.category.coding[N].code = 'https://bluebutton.cms.gov/resources/variables/clm_tot_chrg_amt',"[\n  {\n    ""category"": {\n      ""coding"": [\n        {\n          ""system"": ""http://hl7.org/fhir/us/carin-bb/CodeSystem/C4BBAdjudication"",\n          ""code"": ""priorpayerpaid"",\n          ""display"": ""Prior payer paid""\n        },\n        {\n          ""system"": ""https://bluebutton.cms.gov/resources/codesystem/adjudication"",\n          ""code"": ""https://bluebutton.cms.gov/resources/variables/clm_tot_chrg_amt"",\n          ""display"": ""Claim Total Charge Amount""\n        }\n      ]\n    },\n    ""amount"": {\n      ""value"": 0,\n      ""currency"": ""USD""\n    }\n  }\n]",eob.total.category.coding[N].display = 'Prior payer paid';eob.total.category.coding[N].system = 'https://bluebutton.cms.gov/resources/codesystem/adjudication';eob.total.category.coding[N].code = 'https://bluebutton.cms.gov/resources/variables/clm_tot_chrg_amt';eob.total.category.coding[N].display = 'Claim Total Charge Amount');eob.total.amount.currency = 'USD',,,CARR_CLM_PRMRY_PYR_PD_AMT,,CLAIM,carr_clm_prmry_pyr_pd_amt,primaryPayerPaidAmount,,X,,X,X,X
17,Provider Assignement Indicator,Variable indicates whether or not the provider accepts assignment for the noninstitutional claim.,Carrier;DME,CHAR,1,ExplanationOfBenefit,extension[N].valueCoding.code,extension.where(url='https://bluebutton.cms.gov/resources/variables/asgmntcd').valueCoding.code,extension[N].url = 'https://bluebutton.cms.gov/resources/variables/asgmntcd',"[\n  {\n    ""url"": ""https://bluebutton.cms.gov/resources/variables/asgmntcd"",\n    ""valueCoding"": {\n      ""system"": ""https://bluebutton.cms.gov/resources/variables/asgmntcd"",\n      ""code"": ""A"",\n      ""display"": ""Assigned claim""\n    }\n  }\n]",eob.extension[N].valueCoding.display = {corresponding description from valueset specified in .system},,,CARR_CLM_PRVDR_ASGNMT_IND_SW,,CLAIM,carr_clm_prvdr_asgnmt_ind_sw,providerAssignmentIndicator,,X,,X,X,X
18,Referring Provider Id Number,The provider identification number (PIN) of the physician/supplier (assigned by the MAC) who referred the beneficiary to the physician who ordered these services.,Carrier,CHAR,14,ExplanationOfBenefit,careTeam[N].provider.identifier[N].value,careTeam.where(role.coding.where(code = 'referring')).provider.identifier.where(type.coding.where(code='npi')).value,careTeam[N].role.coding[N].system = 'http://hl7.org/fhir/us/carin-bb/CodeSystem/C4BBClaimCareTeamRole';careTeam[N].role.coding[N].code = 'referring';careTeam[N].provider.identifier[N].type.coding[N].code = 'npi',"[\n  {\n    ""type"": {\n      ""coding"": [\n        {\n          ""system"": ""http://hl7.org/fhir/us/carin-bb/CodeSystem/C4BBIdentifierType"",\n          ""code"": ""npi"",\n          ""display"": ""National Provider Identifier""\n        }\n      ]\n    },\n    ""value"": ""8765676""\n  },\n  {\n    ""type"": {\n      ""coding"": [\n        {\n          ""system"": ""http://hl7.org/fhir/us/carin-bb/CodeSystem/C4BBIdentifierType"",\n          ""code"": ""npi"",\n          ""display"": ""National Provider Identifier""\n        }\n      ]\n    },\n    ""value"": ""K25852""\n  }\n]",eob.careTeam[N].role.coding[N].display = 'Referring';eob.careTeam[N].provider.identifier[N].type.coding[N].system = 'http://hl7.org/fhir/us/carin-bb/CodeSystem/C4BBIdentifierType';eob.careTeam[N].provider.identifier[N].type.coding[N].display = 'National Provvider Identifier',,"There may be multiple referring providers, some of which may not be from this field in the database.",CARR_CLM_RFRNG_PIN_NUM,,CLAIM,carr_clm_rfrng_pin_num,referringProviderIdNumber,X,X,,X,X,X
19,Anesthesia Unit Count,The base number of units assigned to the line item anesthesia procedure on the carrier claim (non-DMERC).,Carrier,NUM,2,ExplanationOfBenefit,item[N].extension[N].valueQuantity.value,item[%n].extension.where(url = 'https://bluebutton.cms.gov/resources/variables/carr_line_ansthsa_unit_cnt').valueQuantity.value,item[N].extension[N].url = 'https://bluebutton.cms.gov/resources/variables/carr_line_ansthsa_unit_cnt',,,,,CARR_LINE_ANSTHSA_UNIT_CNT,,CLAIM LINE,carr_line_ansthsa_unit_cnt,anesthesiaUnitCount,X,X,,X,X,X
20,CLIA Lab Number,The identification number assigned to the clinical laboratory providing services for the line item on the carrier claim (non-DMERC).,Carrier,CHAR,10,ExplanationOfBenefit,item[N].locationCodeableConcept.extension[N].valueCoding.code,item[%n].locationCodeableConcept.extension.where(url = 'https://bluebutton.cms.gov/resources/variables/carr_line_clia_lab_num').valueIdentifier.value,item[N].locationCodeableConcept.extension[N].url = 'https://bluebutton.cms.gov/resources/variables/carr_line_clia_lab_num',"[\n  {\n    ""url"": ""https://bluebutton.cms.gov/resources/variables/carr_line_clia_lab_num"",\n    ""valueIdentifier"": {\n      ""system"": ""https://bluebutton.cms.gov/resources/variables/carr_line_clia_lab_num"",\n      ""value"": ""BB889999AA""\n    }\n  }\n]",eob.item[N].locationCodeableConcept.extension[N].valueCoding.display = {corresponding description from valueset specified in .system},,,CARR_LINE_CLIA_LAB_NUM,,CLAIM LINE,carr_line_clia_lab_num,cliaLabNumber,X,X,,X,X,X
21,Carrier MTUS Indicator Code,Code indicating the units associated with services needing unit reporting on the line item for the carrier claim (non-DMERC).,Carrier,CHAR,1,ExplanationOfBenefit,item[N].extension[N].valueCoding.code,item[%n].extension.where(url = 'https://bluebutton.cms.gov/resources/variables/carr_line_mtus_cd').valueCoding.code,item[N].extension[N].url = 'https://bluebutton.cms.gov/resources/variables/carr_line_mtus_cd',"[\n  {\n    ""url"": ""https://bluebutton.cms.gov/resources/variables/carr_line_mtus_cd"",\n    ""valueCoding"": {\n      ""system"": ""https://bluebutton.cms.gov/resources/variables/carr_line_mtus_cd"",\n      ""code"": ""3"",\n      ""display"": ""Services""\n    }\n  }\n]",eob.item[N].extension[N].valueCoding.display = {corresponding description from valueset specified in .system},,,CARR_LINE_MTUS_CD,,CLAIM,carr_line_mtus_cd,mtusCode,,X,,X,X,X
22,Carrier MTUS Count,"The count of the total units associated with services needing unit reporting such as transportation, miles, anesthesia time units, number of services, volume of oxygen or blood units.",Carrier,NUM,11,ExplanationOfBenefit,item[N].extension[N].valueQuantity.value,item[%n].extension.where(url = 'https://bluebutton.cms.gov/resources/variables/carr_line_mtus_cnt').valueQuantity.value,item[N].extension[N].url = 'https://bluebutton.cms.gov/resources/variables/carr_line_mtus_cnt',"[\n  {\n    ""url"": ""https://bluebutton.cms.gov/resources/variables/carr_line_mtus_cnt"",\n    ""valueQuantity"": {\n      ""value"": 1\n    }\n  },\n  {\n    ""url"": ""https://bluebutton.cms.gov/resources/variables/carr_line_mtus_cnt"",\n    ""valueCoding"": {\n      ""system"": ""https://bluebutton.cms.gov/resources/variables/carr_line_mtus_cnt"",\n      ""code"": ""3""\n    }\n  }\n]",,,,CARR_LINE_MTUS_CNT,,CLAIM,carr_line_mtus_cnt,mtusCount,,X,,X,X,X
